228799287746760704	105541906	Fri Jul 27 10:29:35 +0000 2012			<a href="http://bitly.com" rel="nofollow">bitly</a>	false		New York City	"The April Ashley Project" - Story of #Transgender Pioneer - Begins Filming #trans #girlslikeus #uk http://t.co/tgocHnSm	TransNewsDaily
228806589677727744	555090615	Fri Jul 27 10:58:36 +0000 2012			<a href="http://www.echofon.com/" rel="nofollow">Echofon</a>	false		in the cisnormative world	Modify that last part I could say to HBSers: "Legitimacy isn't commodity. If you fear losing it, then you never possessed it." #girlslikeus	Patience Newbury
228853440065978368	149339343	Fri Jul 27 14:04:46 +0000 2012			web	false		The Evergreen State	RT @PrincessComics: The Princess is updated: http://t.co/VGIl5QAs #transgender #webcomic #girlslikeus #swimsuit	Cecilia
228860465609060352	264434173	Fri Jul 27 14:32:41 +0000 2012			<a href="http://www.tweetdeck.com" rel="nofollow">TweetDeck</a>	false			The Wachowskis &amp; Tom Tykwer talk Cloud Atlas (with a first on camera appearance by Lana!) #girlslikeus http://t.co/pWfYPFTk	Autumn
228878753042935808	18634831	Fri Jul 27 15:45:21 +0000 2012			<a href="http://www.hootsuite.com" rel="nofollow">HootSuite</a>	false		ÜT: 43.244273,-87.921308	I'm a LOVER not a fighter, but I believe U should know your enemy &amp; choose wisely how you spend your time &amp; money.  #Chickfila #GirlsLikeUs	Angelica Ross
228892426205536256	37298086	Fri Jul 27 16:39:41 +0000 2012			<a href="http://www.motorola.com" rel="nofollow">DROID</a>	false		Kansas	RT @GEMSGIRLS: Have you heard? GEMS' 1st #benefit event is October 17! #GirlsLikeUs #endCSEC Tickets available here! http://t.co/TwhTi053	what2say2day
