221772746319855617	410501035	Sun Jul 08 01:08:37 +0000 2012			<a href="http://www.tweetcaster.com" rel="nofollow">TweetCaster for Android</a>	false		Ontari-ari-o CANUKLAND BABY	RT @Arizona_Abby: To all who follow the #girlslikeus tag, the @GirlsLikeUs_ acct is *not* run by other trans women &amp; IMO projects an ...	cisgendersinglemamma
221780514279915520	439578027	Sun Jul 08 01:39:29 +0000 2012			<a href="http://twitter.com/download/android" rel="nofollow">Twitter for Android</a>	false		Madison, WI, United States	RT @Arizona_Abby: To all who follow the #girlslikeus tag, the @GirlsLikeUs_ acct is *not* run by other trans women &amp; IMO projects an ...	Samantha Kingston
221800189793550337	19471651	Sun Jul 08 02:57:40 +0000 2012			web	false		Houston, TX	Black #girlslikeus are beautiful too and are part of the kente cloth fabric of the African-American community	Monica Roberts
221811975406096384	17413730	Sun Jul 08 03:44:30 +0000 2012			web	false		Lincoln, RI	RT @TransGriot: There's a lot of smart, talented and beautiful #girlslikeus  Cis peeps have to open your eyes, minds and hearts to see it.	Scout
222026149453238272	61199572	Sun Jul 08 17:55:33 +0000 2012		15120464	web	false		 Depends on when one asks ...	@BillCorbett, @FourthAndFirst TY Bill for ur genuine empathy in ur apology. It's a precarious balance as a comic, no doubt. #girlslikeus	Jessica Whittington
222056922881331200	117785031	Sun Jul 08 19:57:50 +0000 2012			<a href="http://twitter.com/download/android" rel="nofollow">Twitter for Android</a>	false		Boston, USA	Unpaid, yet a good org to get into, #girlslikeus aspiring to media biz: MT "@frontlinepbs: Fall internships,WGBH Boston http://t.co/PMeXreLw	Carolyn Dreamstreet
222058634258030592	205345971	Sun Jul 08 20:04:38 +0000 2012			<a href="http://blackberry.com/twitter" rel="nofollow">Twitter for BlackBerry®</a>	false		Manchester united kingdom 	Probable impossibilities... are to be preferred to improbable possibilities.... #TeamFollowBack   #MuchLove #onelove #girlslikeus	innereve™ I.G.W.T 
222103999678119936	16055389	Sun Jul 08 23:04:54 +0000 2012			<a href="http://www.tweetcaster.com" rel="nofollow">TweetCaster for Android</a>	false		the amen corner.	RT @janetmock: #Trans tween on @datelinenbc now EST. Watching and live-tweeting thoughts, quotes and story to come. #girlslikeus	jawn bon jovi
222111377391763456	18924291	Sun Jul 08 23:34:13 +0000 2012	222111079172550658	133041697	<a href="http://www.hootsuite.com" rel="nofollow">HootSuite</a>	false		Manhattan via Oahu	@SuperJaneEyre I agree. It makes our complicated, varying narratives and journeys palatable to the masses. #girlslikeus	Janet Mock
