369994731196936192	428709287	Wed Aug 21 01:29:52 +0000 2013			<a href="http://twitter.com/download/iphone" rel="nofollow">Twitter for iPhone</a>	false		Southern Indiana	I've never been a stranger to workin hard, but I've been know to play. You won't likely find me letting down my guard. #GirlsLikeUs 💗Miranda	Robinnn	_robin93
370175971162198016	1390065889	Wed Aug 21 13:30:03 +0000 2013			<a href="http://www.tweetdeck.com" rel="nofollow">TweetDeck</a>	false			#girlslikeus we lost another sister and of course the media gets it wrong again. http://t.co/FPh7k06KYq	Dana Taylor	danaequality
370177573445443584	585789428	Wed Aug 21 13:36:25 +0000 2013			<a href="http://www.tweetdeck.com" rel="nofollow">TweetDeck</a>	false		New Jersey	You need to fix this @CBSLA! MT @danaequality: #girlslikeus we lost another sister &amp;of course the media gets it wrong http://t.co/dEeEJONCU3	Amelia	iamAmeliaJune
370268975453589504	967033308	Wed Aug 21 19:39:37 +0000 2013	370237862572077056	18392095	<a href="http://twitter.com/download/iphone" rel="nofollow">Twitter for iPhone</a>	false		#GirlsLikeUs #NRA #tgirlsrock	While my local radio station and Clear Channel has decided to take the $ over principle!  Dumbasses! @AmatoTalk @KFYI http://t.co/akT7lSqvFY	CAMI 	xoCAMILLAxo
370272998139256833	967033308	Wed Aug 21 19:55:36 +0000 2013	370251190501515265	95199102	<a href="http://twitter.com/download/iphone" rel="nofollow">Twitter for iPhone</a>	false		#GirlsLikeUs #NRA #tgirlsrock	The moron did actually comment...  He said it is "frowned upon!"   Really Jesse?  FROWNED UPON?  @ThomasWDowd @slone	CAMI 	xoCAMILLAxo
370291108841926656	398332361	Wed Aug 21 21:07:34 +0000 2013			<a href="http://twitter.com/download/iphone" rel="nofollow">Twitter for iPhone</a>	false			#Intersectionality is TOO important to ignore! #solidarityisforwhitewomen #girlslikeus	Kellye P Murphy	KellyePMurphy
