404107416632975360	967033308	Sat Nov 23 04:41:30 +0000 2013			<a href="http://twitter.com/download/iphone" rel="nofollow">Twitter for iPhone</a>	0		#GirlsLikeUs #NRA #tgirlsrock	RT @Jagauress: ObamaCare Is a Scam Artist's Dream  http://t.co/m7XofkW2Dg  Coulter is NEVER one to mince words. http://t.co/wfshnnggP7	CAMI	xoCAMILLAxo
404321447813734400	18924291	Sat Nov 23 18:51:59 +0000 2013	404303947201916928	188736574	web	0		New York City	@MrsTeriDawn Me too. It's the world we're all working hard everyday to create. #girlslikeus	Janet Mock	janetmock
404324224187502592	604607829	Sat Nov 23 19:03:01 +0000 2013			<a href="http://twitter.com/download/android" rel="nofollow">Twitter for Android</a>	0		#GirlsLikeUs 	Dr Poo ;) http://t.co/ElqPf7S6al	Lisa Quinn	lisaquinn345
404339688795697152	541106425	Sat Nov 23 20:04:28 +0000 2013			web	0		Global / New York City	LGBT Leaders fail to inquire why Simone Wilson, "Mother of man accused of beating transgender woman.. http://t.co/sBIpJ3B1HE  #girlslikeus	I Am Luz's Daughter	Luzs_D_Cares
404352728928772097	967033308	Sat Nov 23 20:56:17 +0000 2013	404349153515290624	613232256	<a href="http://twitter.com/download/iphone" rel="nofollow">Twitter for iPhone</a>	0		#GirlsLikeUs #NRA #tgirlsrock	This is just sickening!  @STOPANIMALABUS5 @Rickmayhem	CAMI	xoCAMILLAxo
404366427563388928	425409745	Sat Nov 23 21:50:43 +0000 2013			<a href="http://twitter.com/download/android" rel="nofollow">Twitter for Android</a>	0		Formerly Tips for Trans Men	Current Drug Shortages - Check to see if your prescriptions are in short-supply! http://t.co/7KCUw5X1xg #trans #girlslikeus #guyslikeus	Tips for Trans Folks	Tips4TransFolks
