408264789514002433	425409745	Wed Dec 04 16:01:25 +0000 2013			<a href="http://www.tumblr.com/" rel="nofollow">Tumblr</a>	0		Formerly Tips for Trans Men	PSA: transphobia isn’t an “opinion” and doesn’t deserve any respect http://t.co/ih2lP05BPt #trans #girlslikeus #guyslikeus	Tips for Trans Folks	Tips4TransFolks
408273811419590656	39332857	Wed Dec 04 16:37:16 +0000 2013			web	0		LA-NYC-Mid Ohio Valley	Intelligence is power. Honesty is key. To know your self worth and identity is empowering. Defying the odds day by day. #girlslikeus	Kara Nicole	IamKaraNicole
408277322312478720	105637300	Wed Dec 04 16:51:13 +0000 2013			<a href="http://twitter.com/download/android" rel="nofollow">Twitter for Android</a>	0		Afuera	There needs to be a law that #girlslikeus are never to be named after industrial polymers for any reason ever.	voz	metalmujer
408284599543169024	105637300	Wed Dec 04 17:20:08 +0000 2013			<a href="http://twitter.com/download/android" rel="nofollow">Twitter for Android</a>	0		Afuera	RT @janetmock: @metalmujer It is a good thing, and I will FOR sure let you + #girlslikeus know about @jaredleto's portrayal when I see the …	voz	metalmujer
408287632003592192	967033308	Wed Dec 04 17:32:11 +0000 2013			<a href="http://twitter.com/download/iphone" rel="nofollow">Twitter for iPhone</a>	0		#GirlsLikeUs #NRA #tgirlsrock	RT @jjauthor: If you believe there is life on Mars, but none in an unborn baby, #YouMightBeALiberal #womenrule http://t.co/jfoFkNJCGx	CAMI	xoCAMILLAxo
408288537713197056	967033308	Wed Dec 04 17:35:47 +0000 2013	408287657647566850	304475591	<a href="http://twitter.com/download/iphone" rel="nofollow">Twitter for iPhone</a>	0		#GirlsLikeUs #NRA #tgirlsrock	VP Biden even admitted they stayed away from Tort Reform bcuz of the "Lawyer Lobby!". @TwitTurdDaily @UniteBlueSC @MarineReconDad @jgrovum	CAMI	xoCAMILLAxo
408346955945754625	1049860370	Wed Dec 04 21:27:55 +0000 2013			web	0		 Massachusetts	NEW: what do #Banksy the #pillsbury doughboy and @MileyCyrus have in common?  #ArtistJackie  #girlslikeus #Trans100 http://t.co/iFIeZSA5ba	Artist Jackie	MsJackieFrances
