295698360730542080	105637300	Mon Jan 28 01:02:37 +0000 2013			<a href="http://twitter.com/download/android" rel="nofollow">Twitter for Android</a>	false		Afuera	#girlslikeus, mis hermanas, are as real as it gets. Respect this or go home.	voz
295756498041176064	1003532215	Mon Jan 28 04:53:38 +0000 2013			<a href="http://twitter.com/download/iphone" rel="nofollow">Twitter for iPhone</a>	false			RT @fakerapper: #GirlsLikeUs #BlackTransProud RT@huffpostgay:LOOK: 11 trans artists of color you should know in 2013 (via @fakerapper) h ...	Bad Flower Queer Art
295856222031196160	14720566	Mon Jan 28 11:29:54 +0000 2013			web	false			Passport FTW! Was confused about reqs/forms so I wrote a simple guide for us Americans. http://t.co/SHzylBqF #girlslikeus	amy dobrowolsky
295862677123768320	604607829	Mon Jan 28 11:55:33 +0000 2013	295860794862759936	19086367	<a href="http://twitter.com/download/android" rel="nofollow">Twitter for Android</a>	false		#GirlsLikeUs	@scattermoon hey that happened to me earlier too. Funny thing is we had previously spoke years ago when my name was different. All ok tho'.	Lisa Quinn
295916590682226688	320742074	Mon Jan 28 15:29:47 +0000 2013	295905230959308800	103983129	web	false		Belgique	Emotions gone numb Though the pain is still in me The tears will not come #haiku #girlslikeus http://t.co/cQDL5wuX rt @BobbiJ0609	SlenderFrame71
295937482212663296	1128558624	Mon Jan 28 16:52:48 +0000 2013			<a href="http://twitter.com/download/iphone" rel="nofollow">Twitter for iPhone</a>	false		Miami, FL	RT @tonidorsay: You decide what power others have over your heart. #transgender #trans #girlslikeus Let no one unworthy have any leverag ...	TransActions
295979706430414848	81862442	Mon Jan 28 19:40:35 +0000 2013			<a href="http://www.hootsuite.com" rel="nofollow">HootSuite</a>	false		San Francisco	Great interview &amp; sweet love story! Go, Clair! MT @clairjoyfarley: Check out this positive love story for #girlslikeus http://t.co/VyRHJ9iq	Kristy Lin Billuni
296014120526954497	105541906	Mon Jan 28 21:57:20 +0000 2013			<a href="http://bitly.com" rel="nofollow">bitly</a>	false		New York City	Pham Le Quynh Tram, #Transgender Vietnamese Woman, Loses Government Recognition http://t.co/Lqj1Heo2 #trans #girlslikeus #vietnam	TransNewsDaily
